{
  "$schema": "https://json-schema.org/draft/2020-12/schema",
  "$id": "https://github.com/iurysenck/tbh-beacon-store/schema/manifest.schema.json",
  "title": "Beacon mod manifest",
  "description": "One JSON file per mod in mods/<id>.json. CI validates every manifest against this schema on every PR, then rebuilds the pinned commit from source and hashes the result -- nothing here is trusted at face value, it's just the pointer CI uses to go get and verify the real thing.",
  "type": "object",
  "additionalProperties": false,
  "required": [
    "id",
    "name",
    "description",
    "author",
    "repoUrl",
    "pinnedCommit",
    "entryProject",
    "assemblyName",
    "category",
    "injectable",
    "sdkVersion",
    "license"
  ],
  "properties": {
    "id": {
      "type": "string",
      "pattern": "^[a-z][a-z0-9_]*$",
      "description": "Unique, lowercase, matches the manifest filename (mods/<id>.json) and the mod's own PLUGIN_INFO id."
    },
    "name": {
      "type": "string",
      "minLength": 1,
      "maxLength": 60
    },
    "description": {
      "type": "object",
      "description": "Localized short description, one entry per supported language. The store page and the in-app store are user-facing material, and this project requires Portuguese, English and Spanish for all user-facing text, so all three are required here. `name` stays a plain string on purpose: mod names are proper nouns (\"Beacon Chest\") and are not translated.",
      "additionalProperties": false,
      "required": [
        "pt",
        "en",
        "es"
      ],
      "properties": {
        "pt": {
          "type": "string",
          "minLength": 1,
          "maxLength": 280
        },
        "en": {
          "type": "string",
          "minLength": 1,
          "maxLength": 280
        },
        "es": {
          "type": "string",
          "minLength": 1,
          "maxLength": 280
        }
      }
    },
    "author": {
      "type": "string",
      "minLength": 1
    },
    "repoUrl": {
      "type": "string",
      "format": "uri",
      "pattern": "^https://"
    },
    "pinnedCommit": {
      "type": "string",
      "pattern": "^[0-9a-f]{40}$",
      "description": "Full 40-char commit SHA. CI clones exactly this commit, never a branch or tag -- a moving ref would let the source change after review without anyone re-reviewing it."
    },
    "entryProject": {
      "type": "string",
      "description": "Path to the .csproj CI builds, relative to the repo root at repoUrl."
    },
    "assemblyName": {
      "type": "string",
      "description": "Expected output DLL file name, used to verify the build produced what this manifest claims it does."
    },
    "category": {
      "type": "string",
      "enum": [
        "automation",
        "live-data",
        "ui-card",
        "other"
      ]
    },
    "injectable": {
      "type": "boolean",
      "description": "Whether this mod requires the BepInEx bridge (see tbh-beacon-modkit). false means it's a pure Beacon-side plugin with no game-process injection at all."
    },
    "sdkVersion": {
      "type": "string",
      "description": "Minimum BeaconModKit SDK version this mod was built against, e.g. \"1.0.0\"."
    },
    "license": {
      "type": "string",
      "minLength": 1
    },
    "homepage": {
      "type": "string",
      "format": "uri"
    },
    "minBeaconVersion": {
      "type": "string",
      "pattern": "^\\d+\\.\\d+\\.\\d+$",
      "description": "Oldest Beacon version this mod is known to work on, as MAJOR.MINOR.PATCH. Beacon compares it against its own version (src-tauri/tauri.conf.json) and blocks the install with a clear message instead of letting the mod fail at runtime. Optional: leave it out when the mod does not depend on anything version-specific."
    },
    "requires": {
      "type": "array",
      "items": {
        "type": "string",
        "pattern": "^[a-z][a-z0-9_]*$"
      },
      "uniqueItems": true,
      "description": "Ids of other mods that must be installed first. No shipped mod uses this today: every mod talks to Beacon directly over IPC and none depends on another (a deliberate decision, see the modkit's own specs). The field exists so a future mod that consumes data another mod exposes can declare it, instead of failing in a way the user cannot diagnose."
    }
  }
}
