{
  "id": "dpsmeter",
  "name": "Beacon DPS Meter",
  "description": {
    "pt": "Medição de dano por segundo ao vivo para TaskBar Hero.",
    "en": "Live damage-per-second measurement for TaskBar Hero.",
    "es": "Medición de daño por segundo en vivo para TaskBar Hero."
  },
  "author": "Iury Senck",
  "repoUrl": "https://github.com/iurysenck/tbh-beacon-modkit",
  "pinnedCommit": "ba5b1d1c4aabfd2e5dc5af56a7cf090c985692c2",
  "entryProject": "dpsmeter/DpsMeter.csproj",
  "assemblyName": "DpsMeter.dll",
  "category": "live-data",
  "injectable": true,
  "sdkVersion": "1.0.0",
  "license": "AGPL-3.0-only",
  "homepage": "https://github.com/iurysenck/tbh-beacon-modkit"
}
