{
  "id": "rune",
  "name": "Beacon Rune",
  "description": {
    "pt": "Automação de runas para TaskBar Hero.",
    "en": "Rune automation for TaskBar Hero.",
    "es": "Automatización de runas para TaskBar Hero."
  },
  "author": "Iury Senck",
  "repoUrl": "https://github.com/iurysenck/tbh-beacon-modkit",
  "pinnedCommit": "ba5b1d1c4aabfd2e5dc5af56a7cf090c985692c2",
  "entryProject": "rune/RuneMod.csproj",
  "assemblyName": "RuneMod.dll",
  "category": "automation",
  "injectable": true,
  "sdkVersion": "1.0.0",
  "license": "AGPL-3.0-only",
  "homepage": "https://github.com/iurysenck/tbh-beacon-modkit"
}
