{
  "id": "offering",
  "name": "Beacon Offering",
  "description": {
    "pt": "Automação de oferendas para TaskBar Hero.",
    "en": "Offering automation for TaskBar Hero.",
    "es": "Automatización de ofrendas para TaskBar Hero."
  },
  "author": "Iury Senck",
  "repoUrl": "https://github.com/iurysenck/tbh-beacon-modkit",
  "pinnedCommit": "ba5b1d1c4aabfd2e5dc5af56a7cf090c985692c2",
  "entryProject": "offering/OfferingMod.csproj",
  "assemblyName": "OfferingMod.dll",
  "category": "automation",
  "injectable": true,
  "sdkVersion": "1.0.0",
  "license": "AGPL-3.0-only",
  "homepage": "https://github.com/iurysenck/tbh-beacon-modkit"
}
