{
  "id": "soulstone",
  "name": "Beacon Soulstone",
  "description": {
    "pt": "Automação de pedra de alma para TaskBar Hero.",
    "en": "Soulstone automation for TaskBar Hero.",
    "es": "Automatización de piedra de alma para TaskBar Hero."
  },
  "author": "Iury Senck",
  "repoUrl": "https://github.com/iurysenck/tbh-beacon-modkit",
  "pinnedCommit": "ba5b1d1c4aabfd2e5dc5af56a7cf090c985692c2",
  "entryProject": "soulstone/SoulstoneMod.csproj",
  "assemblyName": "SoulstoneMod.dll",
  "category": "automation",
  "injectable": true,
  "sdkVersion": "1.0.0",
  "license": "AGPL-3.0-only",
  "homepage": "https://github.com/iurysenck/tbh-beacon-modkit"
}
