{
  "id": "inventoryops",
  "name": "Beacon Inventory Ops",
  "description": {
    "pt": "Operações de inventário: ordenar itens, mover entre inventário e baú, listar no mercado e trocar.",
    "en": "Inventory operations: sort items, move them between inventory and stash, list them on the market and trade them in.",
    "es": "Operaciones de inventario: ordenar objetos, moverlos entre inventario y baúl, listarlos en el mercado e intercambiarlos."
  },
  "author": "Iury Senck",
  "repoUrl": "https://github.com/iurysenck/tbh-beacon-modkit",
  "pinnedCommit": "ba5b1d1c4aabfd2e5dc5af56a7cf090c985692c2",
  "entryProject": "inventoryops/InventoryOpsMod.csproj",
  "assemblyName": "InventoryOpsMod.dll",
  "category": "automation",
  "injectable": true,
  "sdkVersion": "1.0.0",
  "license": "AGPL-3.0-only",
  "homepage": "https://github.com/iurysenck/tbh-beacon-modkit"
}
