{
  "id": "chestmod",
  "name": "Beacon Chest",
  "description": {
    "pt": "Automação independente de abertura de baús para TaskBar Hero.",
    "en": "Standalone chest-opening automation for TaskBar Hero.",
    "es": "Automatización independiente de apertura de cofres para TaskBar Hero."
  },
  "author": "Iury Senck",
  "repoUrl": "https://github.com/iurysenck/tbh-beacon-modkit",
  "pinnedCommit": "ba5b1d1c4aabfd2e5dc5af56a7cf090c985692c2",
  "entryProject": "chestmod/ChestMod.csproj",
  "assemblyName": "ChestMod.dll",
  "category": "automation",
  "injectable": true,
  "sdkVersion": "1.0.0",
  "license": "AGPL-3.0-only",
  "homepage": "https://github.com/iurysenck/tbh-beacon-modkit"
}
